<?xml version="1.0" encoding="UTF-8"?>
<!--
@author William
-->

<!ELEMENT payments (payment+)>

<!ELEMENT payment (paymentOrderInvID, paymentDateTime)>
<!ELEMENT paymentOrderInvID (#PCDATA)>
<!ELEMENT paymentDateTime (#PCDATA)>